Prestador;Sigla do Prestador;Natureza jurídica;Natureza jurídica_b;Natureza jurídica_c
Prefeitura Municipal de Irupi;PMI;Administração pública direta;Pública;Pública
Prefeitura Municipal de Itabaiana;PMI;Administração pública direta;Pública;Pública
Prefeitura Municipal de Itabaianinha;PMI;Administração pública direta;Pública;Pública
Prefeitura Municipal de Itacaré;PMI;Administração pública direta;Pública;Pública
Prefeitura Municipal de Itaguaçu da Bahia;PMIB;Administração pública direta;Pública;Pública
Prefeitura Municipal de Itajobi;PMI;Administração pública direta;Pública;Pública
Prefeitura Municipal de Itaju;PMI;Administração pública direta;Pública;Pública
Prefeitura Municipal de Italva;PMI;Administração pública direta;Pública;Pública
Prefeitura Municipal de Itambé do Mato Dentro;PMIMD;Administração pública direta;Pública;Pública
Prefeitura Municipal de Itamogi;PMI;Administração pública direta;Pública;Pública
Prefeitura Municipal de Itanhandu;PMI;Administração pública direta;Pública;Pública
Prefeitura Municipal de Itanhangá;PMI;Administração pública direta;Pública;Pública
Prefeitura Municipal de Itanhém;PMI;Administração pública direta;Pública;Pública
Prefeitura Municipal de Itanhomi;PMI;Administração pública direta;Pública;Pública
Prefeitura Municipal de Itaocara;PMI;Administração pública direta;Pública;Pública
Prefeitura Municipal de Itapajipe;PMI;Administração pública direta;Pública;Pública
Prefeitura Municipal de Itapiranga;DEASI;Administração pública direta;Pública;Pública
Prefeitura Municipal de Itapissuma;PMI;Administração pública direta;Pública;Pública
Prefeitura Municipal de Itapororoca;PMI;Administração pública direta;Pública;Pública
Prefeitura Municipal de Itapuã do Oeste;PMIO;Administração pública direta;Pública;Pública
Prefeitura Municipal de Itapuí;PMI;Administração pública direta;Pública;Pública
Prefeitura Municipal de Itarana;PMI;Administração pública direta;Pública;Pública
Prefeitura Municipal de Itarantim;PMI;Administração pública direta;Pública;Pública
Prefeitura Municipal de Itatiaia;PMI;Administração pública direta;Pública;Pública
Prefeitura Municipal de Itatiaiuçu;PMI;Administração pública direta;Pública;Pública
Prefeitura Municipal de Itatuba;PMI;Administração pública direta;Pública;Pública
Prefeitura Municipal de Itaú de Minas;PMIM;Administração pública direta;Pública;Pública
Prefeitura Municipal de Itaúba;PMI;Administração pública direta;Pública;Pública
Prefeitura Municipal de Itiquira;PMI;Administração pública direta;Pública;Pública
Prefeitura Municipal de Itirapina;PMI;Administração pública direta;Pública;Pública
Prefeitura Municipal de Itiruçu;PMI;Administração pública direta;Pública;Pública
Prefeitura Municipal de Itueta;PMI;Administração pública direta;Pública;Pública
Prefeitura Municipal de Itutinga;PMI;Administração pública direta;Pública;Pública
Prefeitura Municipal de Jaçanã;PMJ;Administração pública direta;Pública;Pública
Prefeitura Municipal de Jaci;PMJ;Administração pública direta;Pública;Pública
Prefeitura Municipal de Jaciara;DAE;Administração pública direta;Pública;Pública
Prefeitura Municipal de Jacinto Machado;PMJM;Administração pública direta;Pública;Pública
Prefeitura Municipal de Jacuí;PMJ;Administração pública direta;Pública;Pública
Prefeitura Municipal de Jacuizinho;PMJ;Administração pública direta;Pública;Pública
Prefeitura Municipal de Jáguaraçu;PMJ;Administração pública direta;Pública;Pública
Prefeitura Municipal de Jáguariúna;PMJ;Administração pública direta;Pública;Pública
Prefeitura Municipal de Japaraíba;PMJ;Administração pública direta;Pública;Pública
Prefeitura Municipal de Jaramataia;PMJ;Administração pública direta;Pública;Pública
Prefeitura Municipal de Jardinópolis;PMJ;Administração pública direta;Pública;Pública
Prefeitura Municipal de Jari;PMJ;Administração pública direta;Pública;Pública
Prefeitura Municipal de Jeceaba;PMJ;Administração pública direta;Pública;Pública
Prefeitura Municipal de Jeremoabo;PMJ;Administração pública direta;Pública;Pública
Prefeitura Municipal de Jesuania;PMJ;Administração pública direta;Pública;Pública
Prefeitura Municipal de João Costa;PMJC;Administração pública direta;Pública;Pública
Prefeitura Municipal de João Ramalho;PMJR;Administração pública direta;Pública;Pública
Prefeitura Municipal de Joaquim Felício;PMJF;Administração pública direta;Pública;Pública
Prefeitura Municipal de José Raydan;PMJR;Administração pública direta;Pública;Pública
Prefeitura Municipal de Jumirim;PMJ;Administração pública direta;Pública;Pública
Prefeitura Municipal de Junco do Seridó;PMJS;Administração pública direta;Pública;Pública
Prefeitura Municipal de Junqueirópolis;PMJ;Administração pública direta;Pública;Pública
Prefeitura Municipal de Juruena;PMJ;Administração pública direta;Pública;Pública
Prefeitura Municipal de Jussari;PMJ;Administração pública direta;Pública;Pública
Prefeitura Municipal de Kaloré;PMK;Administração pública direta;Pública;Pública
Prefeitura Municipal de Lábrea;PML;Administração pública direta;Pública;Pública
Prefeitura Municipal de Lafaiete Coutinho;PMLC;Administração pública direta;Pública;Pública
Prefeitura Municipal de Lagamar;PML;Administração pública direta;Pública;Pública
Prefeitura Municipal de Lagoa do Mato;PMLM;Administração pública direta;Pública;Pública
Prefeitura Municipal de Lagoa do Piauí;PMLP;Administração pública direta;Pública;Pública
Prefeitura Municipal de Lagoa dos Três Cantos;PMLTC;Administração pública direta;Pública;Pública
Prefeitura Municipal de Lagoa Dourada;PMLD;Administração pública direta;Pública;Pública
Prefeitura Municipal de Lagoa Grande;PMLG;Administração pública direta;Pública;Pública
Prefeitura Municipal de Lagoinha do Piauí;PMLP;Administração pública direta;Pública;Pública
Prefeitura Municipal de Lajeado do Bugre;PMLB;Administração pública direta;Pública;Pública
Prefeitura Municipal de Lajeado Novo;PMLN;Administração pública direta;Pública;Pública
Prefeitura Municipal de Lajedão;PML;Administração pública direta;Pública;Pública
Prefeitura Municipal de Lamim;PML;Administração pública direta;Pública;Pública
Prefeitura Municipal de Laranjal;PML;Administração pública direta;Pública;Pública
Prefeitura Municipal de Lavínia;PML;Administração pública direta;Pública;Pública
Prefeitura Municipal de Leopoldina;PML;Administração pública direta;Pública;Pública
Prefeitura Municipal de Lindóia;PML;Administração pública direta;Pública;Pública
Prefeitura Municipal de Linha Nova;PMLN;Administração pública direta;Pública;Pública
Prefeitura Municipal de Louveira;PML;Administração pública direta;Pública;Pública
Prefeitura Municipal de Luís Antônio;PMLA;Administração pública direta;Pública;Pública
Prefeitura Municipal de Luisburgo;PML;Administração pública direta;Pública;Pública
Prefeitura Municipal de Macajuba;PMM;Administração pública direta;Pública;Pública
Prefeitura Municipal de Macambira;PMM;Administração pública direta;Pública;Pública
Prefeitura Municipal de Macatuba;SISAM;Administração pública direta;Pública;Pública
Prefeitura Municipal de Macaubal;PMM;Administração pública direta;Pública;Pública
Prefeitura Municipal de Machacalis;PMM;Administração pública direta;Pública;Pública
Prefeitura Municipal de Macururé;PMM;Administração pública direta;Pública;Pública
Prefeitura Municipal de Madre de Deus de Minas;PMMDM;Administração pública direta;Pública;Pública
Prefeitura Municipal de Major Sales;PMMS;Administração pública direta;Pública;Pública
Prefeitura Municipal de Manaíra;PMM;Administração pública direta;Pública;Pública
Prefeitura Municipal de Manicoré;PMM;Administração pública direta;Pública;Pública
Prefeitura Municipal de Maquiné;PMM;Administração pública direta;Pública;Pública
Prefeitura Municipal de Mar de Espanha;PMME;Administração pública direta;Pública;Pública
Prefeitura Municipal de Maracaçumé;PMM;Administração pública direta;Pública;Pública
Prefeitura Municipal de Marajá do Sena;PMMS;Administração pública direta;Pública;Pública
Prefeitura Municipal de Marapoama;PMM;Administração pública direta;Pública;Pública
Prefeitura Municipal de Marau;PMM;Administração pública direta;Pública;Pública
Prefeitura Municipal de Maravilhas;PMM;Administração pública direta;Pública;Pública
Prefeitura Municipal de Maria da Fé;PMMF;Administração pública direta;Pública;Pública
Prefeitura Municipal de Marilac;PMM;Administração pública direta;Pública;Pública
Prefeitura Municipal de Mariluz;PMM;Administração pública direta;Pública;Pública
Prefeitura Municipal de Mário Campos;PMMC;Administração pública direta;Pública;Pública
Prefeitura Municipal de Maripá de Minas;PMMM;Administração pública direta;Pública;Pública
Prefeitura Municipal de Marliéria;PMM;Administração pública direta;Pública;Pública
Prefeitura Municipal de Marmelópolis;PMM;Administração pública direta;Pública;Pública
Prefeitura Municipal de Martinópolis;DAEM;Administração pública direta;Pública;Pública
Prefeitura Municipal de Mascote;PMM;Administração pública direta;Pública;Pública
Prefeitura Municipal de Massaranduba;PMM;Administração pública direta;Pública;Pública
Prefeitura Municipal de Mataraca;PMM;Administração pública direta;Pública;Pública
Prefeitura Municipal de Materlândia;PMM;Administração pública direta;Pública;Pública
Prefeitura Municipal de Matias Barbosa;PMMB;Administração pública direta;Pública;Pública
Prefeitura Municipal de Matinhas;PMM;Administração pública direta;Pública;Pública
Prefeitura Municipal de Matipó;PMM;Administração pública direta;Pública;Pública
Prefeitura Municipal de Mato Leitão;PMML;Administração pública direta;Pública;Pública
Prefeitura Municipal de Mato Queimado;PMMQ;Administração pública direta;Pública;Pública
Prefeitura Municipal de Maturéia;PMM;Administração pública direta;Pública;Pública
Prefeitura Municipal de Mendes;PMM;Administração pública direta;Pública;Pública
Prefeitura Municipal de Mercedes;PMM;Administração pública direta;Pública;Pública
Prefeitura Municipal de Mercês;PMM;Administração pública direta;Pública;Pública
Prefeitura Municipal de Milagres;PMM;Administração pública direta;Pública;Pública
Prefeitura Municipal de Minduri;PMM;Administração pública direta;Pública;Pública
Prefeitura Municipal de Miracema;PMM;Administração pública direta;Pública;Pública
Prefeitura Municipal de Mirassolândia;PMM;Administração pública direta;Pública;Pública
Prefeitura Municipal de Moita Bonita;PMMB;Administração pública direta;Pública;Pública
Prefeitura Municipal de Monsenhor Paulo;PMMP;Administração pública direta;Pública;Pública
Prefeitura Municipal de Montauri;PMM;Administração pública direta;Pública;Pública
Prefeitura Municipal de Monte Alegre de Minas;PMMAM;Administração pública direta;Pública;Pública
Prefeitura Municipal de Monte Alegre do Sul;PMMA;Administração pública direta;Pública;Pública
Prefeitura Municipal de Monte Alegre dos Campos;PMMAC;Administração pública direta;Pública;Pública
Prefeitura Municipal de Monte Santo de Minas;PMMSM;Administração pública direta;Pública;Pública
Prefeitura Municipal de Mormaço;PMM;Administração pública direta;Pública;Pública
Prefeitura Municipal de Morrinhos do Sul;PMMS;Administração pública direta;Pública;Pública
Prefeitura Municipal de Morro Agudo;PMMA;Administração pública direta;Pública;Pública
Prefeitura Municipal de Morro do Chapéu do Piauí;PMMCP;Administração pública direta;Pública;Pública
Prefeitura Municipal de Morro do Pilar;PMMP;Administração pública direta;Pública;Pública
Prefeitura Municipal de Morro Grande;PMMG;Administração pública direta;Pública;Pública
Prefeitura Municipal de Mossâmedes;PMM;Administração pública direta;Pública;Pública
Prefeitura Municipal de Motuca;PMM;Administração pública direta;Pública;Pública
Prefeitura Municipal de Mucugê;PMM;Administração pública direta;Pública;Pública
Prefeitura Municipal de Muliterno;PMM;Administração pública direta;Pública;Pública
Prefeitura Municipal de Munhoz;PMM;Administração pública direta;Pública;Pública
Prefeitura Municipal de Muqui;PMM;Administração pública direta;Pública;Pública
Prefeitura Municipal de Murici dos Portelas;PMMP;Administração pública direta;Pública;Pública
Prefeitura Municipal de Murutinga do Sul;PMMS;Administração pública direta;Pública;Pública
Prefeitura Municipal de Muzambinho;PMM;Administração pública direta;Pública;Pública
Prefeitura Municipal de Nantes;PMN;Administração pública direta;Pública;Pública
Prefeitura Municipal de Natividade;PMN;Administração pública direta;Pública;Pública
Prefeitura Municipal de Natividade da Serra;PMNS;Administração pública direta;Pública;Pública
Prefeitura Municipal de Navegantes;SESAN;Administração pública direta;Pública;Pública
Prefeitura Municipal de Nazareno;PMN;Administração pública direta;Pública;Pública
Prefeitura Municipal de Neves Paulista;PMNP;Administração pública direta;Pública;Pública
Prefeitura Municipal de Nicolau Vergueiro;PMNV;Administração pública direta;Pública;Pública
Prefeitura Municipal de Nilo Peçanha;PMNP;Administração pública direta;Pública;Pública
Prefeitura Municipal de Nortelândia;PMN;Administração pública direta;Pública;Pública
Prefeitura Municipal de Nossa Senhora das Graças;PMNSG;Administração pública direta;Pública;Pública
Prefeitura Municipal de Nossa Senhora do Livramento;PMNSL;Administração pública direta;Pública;Pública
Prefeitura Municipal de Nova Aliança;PMNA;Administração pública direta;Pública;Pública
Prefeitura Municipal de Nova Alvorada;PMNA;Administração pública direta;Pública;Pública
Prefeitura Municipal de Nova Bandeirantes;PMNB;Administração pública direta;Pública;Pública
Prefeitura Municipal de Nova Boa Vista;PMNBV;Administração pública direta;Pública;Pública
Prefeitura Municipal de Nova Canaã;PMNC;Administração pública direta;Pública;Pública
Prefeitura Municipal de Nova Candelária;PMNC;Administração pública direta;Pública;Pública
Prefeitura Municipal de Nova Colinas;PMNC;Administração pública direta;Pública;Pública
Prefeitura Municipal de Nova Europa;PMNE;Administração pública direta;Pública;Pública
Prefeitura Municipal de Nova Hartz;MNH;Administração pública direta;Pública;Pública
Prefeitura Municipal de Nova Independência;PMNI;Administração pública direta;Pública;Pública
Prefeitura Municipal de Nova Ipixuna;PMNI;Administração pública direta;Pública;Pública
Prefeitura Municipal de Nova Itaberaba;PMNI;Administração pública direta;Pública;Pública
Prefeitura Municipal de Nova Lacerda;DAE;Administração pública direta;Pública;Pública
Prefeitura Municipal de Nova Marilândia;DEMAE;Administração pública direta;Pública;Pública
Prefeitura Municipal de Nova Maringá;PMNM;Administração pública direta;Pública;Pública
Prefeitura Municipal de Nova Nazaré;PMNN;Administração pública direta;Pública;Pública
Prefeitura Municipal de Nova Olímpia;PMNO;Administração pública direta;Pública;Pública
Prefeitura Municipal de Nova Olinda do Norte;PMNON;Administração pública direta;Pública;Pública
Prefeitura Municipal de Nova Pádua;PMNP;Administração pública direta;Pública;Pública
Prefeitura Municipal de Nova Ponte;DMAE;Administração pública direta;Pública;Pública
Prefeitura Municipal de Nova Ramada;PMNR;Administração pública direta;Pública;Pública
Prefeitura Municipal de Nova Santa Helena;PMNSH;Administração pública direta;Pública;Pública
Prefeitura Municipal de Nova Serrana;PMNS;Administração pública direta;Pública;Pública
Prefeitura Municipal de Novais;PMN;Administração pública direta;Pública;Pública
Prefeitura Municipal de Novo Airão;PMNA;Administração pública direta;Pública;Pública
Prefeitura Municipal de Novo Cabrais;PMNC;Administração pública direta;Pública;Pública
Prefeitura Municipal de Novo Horizonte;PMNH;Administração pública direta;Pública;Pública
Prefeitura Municipal de Novo Horizonte do Norte;PMNHN;Administração pública direta;Pública;Pública
Prefeitura Municipal de Novo Lino;PMNL;Administração pública direta;Pública;Pública
Prefeitura Municipal de Novo Repartimento;PMNR;Administração pública direta;Pública;Pública
Prefeitura Municipal de Novo Tiradentes;PMNT;Administração pública direta;Pública;Pública
Prefeitura Municipal de Novo Triunfo;PMNT;Administração pública direta;Pública;Pública
Prefeitura Municipal de Novo Xingu;PMNX;Administração pública direta;Pública;Pública
Prefeitura Municipal de Nuporanga;PMN;Administração pública direta;Pública;Pública
Prefeitura Municipal de Ocauçu;PMO;Administração pública direta;Pública;Pública
Prefeitura Municipal de Olaria;PMO;Administração pública direta;Pública;Pública
Prefeitura Municipal de Olho D'Água;PMOD;Administração pública direta;Pública;Pública
Prefeitura Municipal de Olho D'Água do Borges;PMOAB;Administração pública direta;Pública;Pública
Prefeitura Municipal de Olímpio Noronha;PMON;Administração pública direta;Pública;Pública
Prefeitura Municipal de Olivedos;PMO;Administração pública direta;Pública;Pública
Prefeitura Municipal de Onça de Pitangui;PMOT;Administração pública direta;Pública;Pública
Prefeitura Municipal de Oriximiná;PMO;Administração pública direta;Pública;Pública
Prefeitura Municipal de Orlândia;PMO;Administração pública direta;Pública;Pública
Prefeitura Municipal de Orobó;PMO;Administração pública direta;Pública;Pública
Prefeitura Municipal de Ourilândia do Norte;PMON;Administração pública direta;Pública;Pública
Prefeitura Municipal de Ouro Verde;PMOV;Administração pública direta;Pública;Pública
Prefeitura Municipal de Pacaembu;PMP;Administração pública direta;Pública;Pública
Prefeitura Municipal de Pacaraima;PMP;Administração pública direta;Pública;Pública
Prefeitura Municipal de Padre Paraíso;PMPP;Administração pública direta;Pública;Pública
Prefeitura Municipal de Paial;PMP;Administração pública direta;Pública;Pública
Prefeitura Municipal de Palhoça;PMP;Administração pública direta;Pública;Pública
Prefeitura Municipal de Panamá;PMP;Administração pública direta;Pública;Pública
Prefeitura Municipal de Panorama;PMP;Administração pública direta;Pública;Pública
Prefeitura Municipal de Papagaios;PMP;Administração pública direta;Pública;Pública
Prefeitura Municipal de Paracambi;PMP;Administração pública direta;Pública;Pública
Prefeitura Municipal de Paraíso;PMP;Administração pública direta;Pública;Pública
Prefeitura Municipal de Paraíso do Sul;PMPS;Administração pública direta;Pública;Pública
Prefeitura Municipal de Paranaiguara;PMP;Administração pública direta;Pública;Pública
Prefeitura Municipal de Paranaíta;DAE;Administração pública direta;Pública;Pública
Prefeitura Municipal de Pareci Novo;PMPN;Administração pública direta;Pública;Pública
Prefeitura Municipal de Parisi;DAEP;Administração pública direta;Pública;Pública
Prefeitura Municipal de Passa e Fica;PMPeF;Administração pública direta;Pública;Pública
Prefeitura Municipal de Passa Quatro;PMPQ;Administração pública direta;Pública;Pública
Prefeitura Municipal de Passa Tempo;PMPT;Administração pública direta;Pública;Pública
Prefeitura Municipal de Passa-Vinte;PMPV;Administração pública direta;Pública;Pública
Prefeitura Municipal de Passo do Sobrado;PMPS;Administração pública direta;Pública;Pública
Prefeitura Municipal de Pato Bragado;PMPB;Administração pública direta;Pública;Pública
Prefeitura Municipal de Patrocínio do Muriaé;PMPM;Administração pública direta;Pública;Pública
Prefeitura Municipal de Patrocínio Paulista;PMPP;Administração pública direta;Pública;Pública
Prefeitura Municipal de Paulo Bento;PMPB;Administração pública direta;Pública;Pública
Prefeitura Municipal de Pedra Bonita;PMPB;Administração pública direta;Pública;Pública
Prefeitura Municipal de Pedra Branca;PMPB;Administração pública direta;Pública;Pública
Prefeitura Municipal de Pedra Dourada;PMPD;Administração pública direta;Pública;Pública
Prefeitura Municipal de Pedra Lavrada;PMPL;Administração pública direta;Pública;Pública
Prefeitura Municipal de Pedrão;PMP;Administração pública direta;Pública;Pública
Prefeitura Municipal de Pedro Afonso;PMPA;Administração pública direta;Pública;Pública
Prefeitura Municipal de Pentecoste;PMP;Administração pública direta;Pública;Pública
Prefeitura Municipal de Pequi;PMP;Administração pública direta;Pública;Pública
Prefeitura Municipal de Perdigão;PMP;Administração pública direta;Pública;Pública
Prefeitura Municipal de Periquito;PMP;Administração pública direta;Pública;Pública
Prefeitura Municipal de Pescador;PMP;Administração pública direta;Pública;Pública
Prefeitura Municipal de Piau;PMP;Administração pública direta;Pública;Pública
Prefeitura Municipal de Picada Café;PMPC;Administração pública direta;Pública;Pública
Prefeitura Municipal de Pindorama;PMP;Administração pública direta;Pública;Pública
Prefeitura Municipal de Pingo-D'Água;PMPA;Administração pública direta;Pública;Pública
Prefeitura Municipal de Pinhal;PMP;Administração pública direta;Pública;Pública
Prefeitura Municipal de Pinhal da Serra;PMPS;Administração pública direta;Pública;Pública
Prefeitura Municipal de Pinhal Grande;PMPG;Administração pública direta;Pública;Pública
Prefeitura Municipal de Pinheiral;PMP;Administração pública direta;Pública;Pública
Prefeitura Municipal de Pinheiro Machado;PMPM;Administração pública direta;Pública;Pública
Prefeitura Municipal de Pinheiro Preto;PMPP;Administração pública direta;Pública;Pública
Prefeitura Municipal de Pintadas;PMP;Administração pública direta;Pública;Pública
Prefeitura Municipal de Piracema;PMP;Administração pública direta;Pública;Pública
Prefeitura Municipal de Pirangi;PMP;Administração pública direta;Pública;Pública
Prefeitura Municipal de Piranguçu;PMP;Administração pública direta;Pública;Pública
Prefeitura Municipal de Piranguinho;PMP;Administração pública direta;Pública;Pública
Prefeitura Municipal de Pirapó;PMP;Administração pública direta;Pública;Pública
Prefeitura Municipal de Piraúba;PMP;Administração pública direta;Pública;Pública
Prefeitura Municipal de Pitangueiras;PMP;Administração pública direta;Pública;Pública
Prefeitura Municipal de Pitangui;PMP;Administração pública direta;Pública;Pública
Prefeitura Municipal de Planura;PMP;Administração pública direta;Pública;Pública
Prefeitura Municipal de Poção;PMP;Administração pública direta;Pública;Pública
Prefeitura Municipal de Pocinhos;PMP;Administração pública direta;Pública;Pública
Prefeitura Municipal de Poço das Antas;PMPA;Administração pública direta;Pública;Pública
Prefeitura Municipal de Poço Fundo;PMPF;Administração pública direta;Pública;Pública
Prefeitura Municipal de Pocrane;PMP;Administração pública direta;Pública;Pública
Prefeitura Municipal de Pompeu;PMP;Administração pública direta;Pública;Pública
Prefeitura Municipal de Pontal;DAE;Administração pública direta;Pública;Pública
Prefeitura Municipal de Pontão;PMP;Administração pública direta;Pública;Pública
Prefeitura Municipal de Ponte Branca;PMPB;Administração pública direta;Pública;Pública
Prefeitura Municipal de Ponte Preta;PMPP;Administração pública direta;Pública;Pública
Prefeitura Municipal de Ponte Serrada;PMPS;Administração pública direta;Pública;Pública
Prefeitura Municipal de Porciuncula;PMP;Administração pública direta;Pública;Pública
Prefeitura Municipal de Porto Barreiro;PMPB;Administração pública direta;Pública;Pública
Prefeitura Municipal de Porto Calvo;PMPC;Administração pública direta;Pública;Pública
Prefeitura Municipal de Porto dos Gaúchos;PMPC;Administração pública direta;Pública;Pública
Prefeitura Municipal de Porto Firme;PMPF;Administração pública direta;Pública;Pública
Prefeitura Municipal de Porto Mauá;PMPA;Administração pública direta;Pública;Pública
Prefeitura Municipal de Porto Real;PMPR;Administração pública direta;Pública;Pública
Prefeitura Municipal de Porto Vera Cruz;PMPVC;Administração pública direta;Pública;Pública
Prefeitura Municipal de Potim;PMP;Administração pública direta;Pública;Pública
Prefeitura Municipal de Potirendaba;PMP;Administração pública direta;Pública;Pública
Prefeitura Municipal de Pradópolis;PMP;Administração pública direta;Pública;Pública
Prefeitura Municipal de Prata;PMP;Administração pública direta;Pública;Pública
Prefeitura Municipal de Pratápolis;PMP;Administração pública direta;Pública;Pública
Prefeitura Municipal de Pratinha;PMP;Administração pública direta;Pública;Pública
Prefeitura Municipal de Presidente Juscelino;PMPJ;Administração pública direta;Pública;Pública
Prefeitura Municipal de Presidente Kubitschek;PMPK;Administração pública direta;Pública;Pública
