Prestador;Sigla do Prestador;Natureza jurídica;Natureza jurídica_b;Natureza jurídica_c
Prefeitura Municipal de Presidente Lucena;PMPL;Administração pública direta;Pública;Pública
Prefeitura Municipal de Presidente Venceslau;PMPV;Administração pública direta;Pública;Pública
Prefeitura Municipal de Princesa;PMP;Administração pública direta;Pública;Pública
Prefeitura Municipal de Progresso;PMP;Administração pública direta;Pública;Pública
Prefeitura Municipal de Protásio Alves;PMP;Administração pública direta;Pública;Pública
Prefeitura Municipal de Quatis;PMQ;Administração pública direta;Pública;Pública
Prefeitura Municipal de Quatro Irmãos;PMQI;Administração pública direta;Pública;Pública
Prefeitura Municipal de Quatro Pontes;PMQP;Administração pública direta;Pública;Pública
Prefeitura Municipal de Queluzito;PMQ;Administração pública direta;Pública;Pública
Prefeitura Municipal de Querência;PMQD;Administração pública direta;Pública;Pública
Prefeitura Municipal de Quevedos;PMQ;Administração pública direta;Pública;Pública
Prefeitura Municipal de Quinze de Novembro;PMQN;Administração pública direta;Pública;Pública
Prefeitura Municipal de Quixabá;PMQ;Administração pública direta;Pública;Pública
Prefeitura Municipal de Rafael Jambeiro;PMRJ;Administração pública direta;Pública;Pública
Prefeitura Municipal de Rafard;PMR;Administração pública direta;Pública;Pública
Prefeitura Municipal de Rancharia;PMR;Administração pública direta;Pública;Pública
Prefeitura Municipal de Reginópolis;PMR;Administração pública direta;Pública;Pública
Prefeitura Municipal de Relvado;PMR;Administração pública direta;Pública;Pública
Prefeitura Municipal de Remígio;PMR;Administração pública direta;Pública;Pública
Prefeitura Municipal de Ressaquinha;PMR;Administração pública direta;Pública;Pública
Prefeitura Municipal de Riacho das Almas;PMRA;Administração pública direta;Pública;Pública
Prefeitura Municipal de Riacho de Santo Antônio;PMRSA;Administração pública direta;Pública;Pública
Prefeitura Municipal de Ribeirão Bonito;PMRB;Administração pública direta;Pública;Pública
Prefeitura Municipal de Ribeirão Claro;SAAE;Autarquia;Pública;Pública
Prefeitura Municipal de Ribeirãozinho;PMR;Administração pública direta;Pública;Pública
Prefeitura Municipal de Rinópolis;PMR;Administração pública direta;Pública;Pública
Prefeitura Municipal de Rio Bonito;PMRB;Administração pública direta;Pública;Pública
Prefeitura Municipal de Rio Branco;PMRB;Administração pública direta;Pública;Pública
Prefeitura Municipal de Rio Doce;PMRD;Administração pública direta;Pública;Pública
Prefeitura Municipal de Rio Espera;PMRE;Administração pública direta;Pública;Pública
Prefeitura Municipal de Rio Piracicaba;PMRP;Administração pública direta;Pública;Pública
Prefeitura Municipal de Rio Pomba;PMRP;Administração pública direta;Pública;Pública
Prefeitura Municipal de Rio Preto;PMRP;Administração pública direta;Pública;Pública
Prefeitura Municipal de Rio Quente;PMRQ;Administração pública direta;Pública;Pública
Prefeitura Municipal de Rio Vermelho;PMRV;Administração pública direta;Pública;Pública
Prefeitura Municipal de Rochedo de Minas;PMRM;Administração pública direta;Pública;Pública
Prefeitura Municipal de Rodeiro;PMR;Administração pública direta;Pública;Pública
Prefeitura Municipal de Rodelas;PMR;Administração pública direta;Pública;Pública
Prefeitura Municipal de Rolador;PMR;Administração pública direta;Pública;Pública
Prefeitura Municipal de Rondinha;PMR;Administração pública direta;Pública;Pública
Prefeitura Municipal de Roque Gonzales;PMRG;Administração pública direta;Pública;Pública
Prefeitura Municipal de Rorainópolis;PMR;Administração pública direta;Pública;Pública
Prefeitura Municipal de Rosário da Limeira;PMRL;Administração pública direta;Pública;Pública
Prefeitura Municipal de Rosário Oeste;PMRO;Administração pública direta;Pública;Pública
Prefeitura Municipal de Roteiro;PMR;Administração pública direta;Pública;Pública
Prefeitura Municipal de Sabino;PMS;Administração pública direta;Pública;Pública
Prefeitura Municipal de Sagrada Família;PMSF;Administração pública direta;Pública;Pública
Prefeitura Municipal de Sairé;PMS;Administração pública direta;Pública;Pública
Prefeitura Municipal de Sales;PMS;Administração pública direta;Pública;Pública
Prefeitura Municipal de Sales Oliveira;PMSO;Administração pública direta;Pública;Pública
Prefeitura Municipal de Salto do Céu;PMSC;Administração pública direta;Pública;Pública
Prefeitura Municipal de Salto do Jacuí;PMSJ;Administração pública direta;Pública;Pública
Prefeitura Municipal de Salto Grande;PMSG;Administração pública direta;Pública;Pública
Prefeitura Municipal de Salvador das Missões;PMSM;Administração pública direta;Pública;Pública
Prefeitura Municipal de Santa Adélia;PMSA;Administração pública direta;Pública;Pública
Prefeitura Municipal de Santa Bárbara;PMSB;Administração pública direta;Pública;Pública
Prefeitura Municipal de Santa Bárbara do Pará;PMSBP;Administração pública direta;Pública;Pública
Prefeitura Municipal de Santa Cecília do Sul;PMSCS;Administração pública direta;Pública;Pública
Prefeitura Municipal de Santa Clara do Sul;PMSCS;Administração pública direta;Pública;Pública
Prefeitura Municipal de Santa Cruz;PMSC;Administração pública direta;Pública;Pública
Prefeitura Municipal de Santa Cruz da Conceição;PMSCC;Administração pública direta;Pública;Pública
Prefeitura Municipal de Santa Cruz das Palmeiras;PMSCP;Administração pública direta;Pública;Pública
Prefeitura Municipal de Santa Cruz do Capibaribe;PMSCC;Administração pública direta;Pública;Pública
Prefeitura Municipal de Santa Cruz do Escalvado;PMSCE;Administração pública direta;Pública;Pública
Prefeitura Municipal de Santa Helena;PMSH;Administração pública direta;Pública;Pública
Prefeitura Municipal de Santa Inês;PMSI;Administração pública direta;Pública;Pública
Prefeitura Municipal de Santa Juliana;PMSJ;Administração pública direta;Pública;Pública
Prefeitura Municipal de Santa Lúcia;PMSL;Administração pública direta;Pública;Pública
Prefeitura Municipal de Santa Margarida;PMSM;Administração pública direta;Pública;Pública
Prefeitura Municipal de Santa Maria;PMSM;Administração pública direta;Pública;Pública
Prefeitura Municipal de Santa Maria da Serra;PMSMS;Administração pública direta;Pública;Pública
Prefeitura Municipal de Santa Maria de Itabira;PMSMI;Administração pública direta;Pública;Pública
Prefeitura Municipal de Santa Maria Madalena;PMSMM;Administração pública direta;Pública;Pública
Prefeitura Municipal de Santa Rita de Jacutinga;PMSRJ;Administração pública direta;Pública;Pública
Prefeitura Municipal de Santa Rita D'Oeste;PMSRD;Administração pública direta;Pública;Pública
Prefeitura Municipal de Santa Tereza;PMST;Administração pública direta;Pública;Pública
Prefeitura Municipal de Santa Terezinha do Progresso;PMSTP;Administração pública direta;Pública;Pública
Prefeitura Municipal de Santa Vitória;PMSV;Administração pública direta;Pública;Pública
Prefeitura Municipal de Santa Vitória do Palmar;PMSVP;Administração pública direta;Pública;Pública
Prefeitura Municipal de Santana da Boa Vista;PMSBV;Administração pública direta;Pública;Pública
Prefeitura Municipal de Santana de Catáguases;PMSC;Administração pública direta;Pública;Pública
Prefeitura Municipal de Santana de Pirapama;PMSP;Administração pública direta;Pública;Pública
Prefeitura Municipal de Santana do Garambéu;PMSG;Administração pública direta;Pública;Pública
Prefeitura Municipal de Santana do Jacaré;PMSJ;Administração pública direta;Pública;Pública
Prefeitura Municipal de Santana do Riacho;PMSR;Administração pública direta;Pública;Pública
Prefeitura Municipal de Santiago;PMS;Administração pública direta;Pública;Pública
Prefeitura Municipal de Santiago do Sul;PMSS;Administração pública direta;Pública;Pública
Prefeitura Municipal de Santo Afonso;PMSA;Administração pública direta;Pública;Pública
Prefeitura Municipal de Santo Antônio da Alegria;PMSAA;Administração pública direta;Pública;Pública
Prefeitura Municipal de Santo Antônio de Pádua;PMSAP;Administração pública direta;Pública;Pública
Prefeitura Municipal de Santo Antônio de Posse;PMSAP;Administração pública direta;Pública;Pública
Prefeitura Municipal de Santo Antonio do Amparo;PMSAA;Administração pública direta;Pública;Pública
Prefeitura Municipal de Santo Antonio do Aracanguá;PMSAA;Administração pública direta;Pública;Pública
Prefeitura Municipal de Santo Antônio do Jacinto;PMS;Administração pública direta;Pública;Pública
Prefeitura Municipal de Santo Antonio do Leste;PMSAL;Administração pública direta;Pública;Pública
Prefeitura Municipal de Santo Antônio do Planalto;PMSAP;Administração pública direta;Pública;Pública
Prefeitura Municipal de São Bento;PMSB;Administração pública direta;Pública;Pública
Prefeitura Municipal de São Bento Abade;PMSBA;Administração pública direta;Pública;Pública
Prefeitura Municipal de São Bento do Una;PMSBU;Administração pública direta;Pública;Pública
Prefeitura Municipal de São Caetano;PMSC;Administração pública direta;Pública;Pública
Prefeitura Municipal de São Domingos do Cariri;PMSDC;Administração pública direta;Pública;Pública
Prefeitura Municipal de São Domingos do Prata;PMSDP;Administração pública direta;Pública;Pública
Prefeitura Municipal de São Domingos do Sul;PMSDS;Administração pública direta;Pública;Pública
Prefeitura Municipal de São Félix de Minas;PMSFM;Administração pública direta;Pública;Pública
Prefeitura Municipal de São Félix do Araguaia;PMSFA;Administração pública direta;Pública;Pública
Prefeitura Municipal de São Fidélis;PMSF;Administração pública direta;Pública;Pública
Prefeitura Municipal de São Francisco de Sales;PMSFS;Administração pública direta;Pública;Pública
Prefeitura Municipal de São Francisco do Glória;PMSFG;Administração pública direta;Pública;Pública
Prefeitura Municipal de São Geraldo;PMSG;Administração pública direta;Pública;Pública
Prefeitura Municipal de São Geraldo da Piedade;PMSGP;Administração pública direta;Pública;Pública
Prefeitura Municipal de São Gonçalo do Gurguéia;PMSG;Administração pública direta;Pública;Pública
Prefeitura Municipal de São Gonçalo do Rio Abaixo;PMSGRA;Administração pública direta;Pública;Pública
Prefeitura Municipal de São Gonçalo do Sapucaí;PMSGS;Administração pública direta;Pública;Pública
Prefeitura Municipal de São João da Barra;PMSJB;Administração pública direta;Pública;Pública
Prefeitura Municipal de São João da Lagoa;PMSJL;Administração pública direta;Pública;Pública
Prefeitura Municipal de São João da Mata;PMSJ;Administração pública direta;Pública;Pública
Prefeitura Municipal de São João da Varjota;PMSJV;Administração pública direta;Pública;Pública
Prefeitura Municipal de São João do Arraial;PMSJA;Administração pública direta;Pública;Pública
Prefeitura Municipal de São João do Cariri;PMSJC;Administração pública direta;Pública;Pública
Prefeitura Municipal de São João do Oeste;PMSJO;Administração pública direta;Pública;Pública
Prefeitura Municipal de São João do Oriente;PMSJO;Administração pública direta;Pública;Pública
Prefeitura Municipal de São João do Pacuí;PMSJP;Administração pública direta;Pública;Pública
Prefeitura Municipal de São João do Polêsine;PMSJP;Administração pública direta;Pública;Pública
Prefeitura Municipal de São João do Rio do Peixe;PMSJRP;Administração pública direta;Pública;Pública
Prefeitura Municipal de São João do Soter;PMSJS;Administração pública direta;Pública;Pública
Prefeitura Municipal de São Joaquim da Barra;PMSJB;Administração pública direta;Pública;Pública
Prefeitura Municipal de São José da Barra;PMSJB;Administração pública direta;Pública;Pública
Prefeitura Municipal de São José da Bela Vista;PMSJBV;Administração pública direta;Pública;Pública
Prefeitura Municipal de São José da Lagoa Tapada;PMSJLT;Administração pública direta;Pública;Pública
Prefeitura Municipal de São José da Safira;PMSJS;Administração pública direta;Pública;Pública
Prefeitura Municipal de São José da Varginha;PMSJV;Administração pública direta;Pública;Pública
Prefeitura Municipal de São José das Missões;PMSJM;Administração pública direta;Pública;Pública
Prefeitura Municipal de São José do Barreiro;PMSJB;Administração pública direta;Pública;Pública
Prefeitura Municipal de São José do Brejo do Cruz;PMSJBC;Administração pública direta;Pública;Pública
Prefeitura Municipal de São José do Calçado;PMSJC;Administração pública direta;Pública;Pública
Prefeitura Municipal de São José do Campestre;PMSJC;Administração pública direta;Pública;Pública
Prefeitura Municipal de São José do Cedro;PMSJC;Administração pública direta;Pública;Pública
Prefeitura Municipal de São José do Goiabal;PMSJG;Administração pública direta;Pública;Pública
Prefeitura Municipal de São José do Hortêncio;PMSJH;Administração pública direta;Pública;Pública
Prefeitura Municipal de São José do Sabugi;PMSJS;Administração pública direta;Pública;Pública
Prefeitura Municipal de São José do Sul;PMSJS;Administração pública direta;Pública;Pública
Prefeitura Municipal de São José dos Ausentes;PMSJA;Administração pública direta;Pública;Pública
Prefeitura Municipal de São Lourenço do Oeste;PMSLO;Administração pública direta;Pública;Pública
Prefeitura Municipal de São Mamede;PMSM;Administração pública direta;Pública;Pública
Prefeitura Municipal de São Martinho da Serra;PMSMS;Administração pública direta;Pública;Pública
Prefeitura Municipal de São Mateus do Maranhão;PMSMM;Administração pública direta;Pública;Pública
Prefeitura Municipal de São Miguel de Taipu;PMSMT;Administração pública direta;Pública;Pública
Prefeitura Municipal de São Miguel do Anta;PMSMA;Administração pública direta;Pública;Pública
Prefeitura Municipal de São Miguel do Guamá;PMSMG;Administração pública direta;Pública;Pública
Prefeitura Municipal de São Miguel do Tapuio;PMSMT;Administração pública direta;Pública;Pública
Prefeitura Municipal de São Paulo das Missões;PMSPM;Administração pública direta;Pública;Pública
Prefeitura Municipal de São Pedro da União;PMSPU;Administração pública direta;Pública;Pública
Prefeitura Municipal de São Pedro das Missões;PMSPM;Administração pública direta;Pública;Pública
Prefeitura Municipal de São Pedro de Alcântara;PMAPA;Administração pública direta;Pública;Pública
Prefeitura Municipal de São Pedro do Butiá;PMSPB;Administração pública direta;Pública;Pública
Prefeitura Municipal de São Pedro do Suaçuí;PMSPS;Administração pública direta;Pública;Pública
Prefeitura Municipal de São Roque do Canaã;PMSRC;Administração pública direta;Pública;Pública
Prefeitura Municipal de São Sebastião da Boa Vista;PMSSBV;Administração pública direta;Pública;Pública
Prefeitura Municipal de São Sebastião do Oeste;PMSSO;Administração pública direta;Pública;Pública
Prefeitura Municipal de São Sebastião do Rio Verde;PMSSRV;Administração pública direta;Pública;Pública
Prefeitura Municipal de São Sebastião do Umbuzeiro;PMSSU;Autarquia;Pública;Pública
Prefeitura Municipal de São Sepé;PMSS;Administração pública direta;Pública;Pública
Prefeitura Municipal de São Simão;PMSS;Administração pública direta;Pública;Pública
Prefeitura Municipal de São Thomé das Letras;PMSTL;Administração pública direta;Pública;Pública
Prefeitura Municipal de São Tomás de Aquino;PMSTA;Administração pública direta;Pública;Pública
Prefeitura Municipal de São Valentim do Sul;PMSVS;Administração pública direta;Pública;Pública
Prefeitura Municipal de São Valério do Sul;PMSVS;Administração pública direta;Pública;Pública
Prefeitura Municipal de São Vendelino;PMSV;Administração pública direta;Pública;Pública
Prefeitura Municipal de São Vicente de Minas;PMSVM;Administração pública direta;Pública;Pública
Prefeitura Municipal de Sardoá;PMS;Administração pública direta;Pública;Pública
Prefeitura Municipal de Schroeder;PMS;Administração pública direta;Pública;Pública
Prefeitura Municipal de Sebastião Laranjeiras;PMSL;Administração pública direta;Pública;Pública
Prefeitura Municipal de Seberi;PMS;Administração pública direta;Pública;Pública
Prefeitura Municipal de Senador Alexandre Costa;PMSAC;Administração pública direta;Pública;Pública
Prefeitura Municipal de Senador Amaral;PMSA;Administração pública direta;Pública;Pública
Prefeitura Municipal de Senador Cortes;PMSC;Administração pública direta;Pública;Pública
Prefeitura Municipal de Senador José Porfírio;PMSJP;Administração pública direta;Pública;Pública
Prefeitura Municipal de Senador Pompeu;PMSP;Administração pública direta;Pública;Pública
Prefeitura Municipal de Senador Salgado Filho;PMSSF;Administração pública direta;Pública;Pública
Prefeitura Municipal de Senhora dos Remédios;PMSR;Administração pública direta;Pública;Pública
Prefeitura Municipal de Sericita;PMS;Administração pública direta;Pública;Pública
Prefeitura Municipal de Seridó;PMS;Administração pública direta;Pública;Pública
Prefeitura Municipal de Sério;PMS;Administração pública direta;Pública;Pública
Prefeitura Municipal de Seritinga;PMS;Administração pública direta;Pública;Pública
Prefeitura Municipal de Serra Alta;PMSA;Administração pública direta;Pública;Pública
Prefeitura Municipal de Serra Caiada;PMSC;Administração pública direta;Pública;Pública
Prefeitura Municipal de Serra do Salitre;PMSS;Administração pública direta;Pública;Pública
Prefeitura Municipal de Serra Talhada;PMST;Administração pública direta;Pública;Pública
Prefeitura Municipal de Serrana;PMS;Administração pública direta;Pública;Pública
Prefeitura Municipal de Serrania;PMS;Administração pública direta;Pública;Pública
Prefeitura Municipal de Serranos;PMS;Administração pública direta;Pública;Pública
Prefeitura Municipal de Serrita;PMS;Administração pública direta;Pública;Pública
Prefeitura Municipal de Sertaneja;PMS;Administração pública direta;Pública;Pública
Prefeitura Municipal de Sertania;PMS;Administração pública direta;Pública;Pública
Prefeitura Municipal de Silveirania;PMS;Administração pública direta;Pública;Pública
Prefeitura Municipal de Silves;PMS;Administração pública direta;Pública;Pública
Prefeitura Municipal de Silvianópolis;PMS;Administração pública direta;Pública;Pública
Prefeitura Municipal de Simonésia;pmsim;Administração pública direta;Pública;Pública
Prefeitura Municipal de Simplício Mendes;PMSM;Administração pública direta;Pública;Pública
Prefeitura Municipal de Sinimbu;PMS;Administração pública direta;Pública;Pública
Prefeitura Municipal de Solidão;PMS;Administração pública direta;Pública;Pública
Prefeitura Municipal de Solonópole;PMS;Administração pública direta;Pública;Pública
Prefeitura Municipal de Sombrio;PMS;Administração pública direta;Pública;Pública
Prefeitura Municipal de Sul Brasil;PMSB;Administração pública direta;Pública;Pública
Prefeitura Municipal de Sumidouro;PMS;Administração pública direta;Pública;Pública
Prefeitura Municipal de Sussuapara;PMS;Administração pública direta;Pública;Pública
Prefeitura Municipal de Suzanápolis;PMS;Administração pública direta;Pública;Pública
Prefeitura Municipal de Tabapuã;PMT;Administração pública direta;Pública;Pública
Prefeitura Municipal de Tabocas do Brejo Velho;PMTBV;Administração pública direta;Pública;Pública
Prefeitura Municipal de Taiaçu;PMT;Administração pública direta;Pública;Pública
Prefeitura Municipal de Taiuva;PMT;Administração pública direta;Pública;Pública
Prefeitura Municipal de Tambaú;DEMAET;Administração pública direta;Pública;Pública
Prefeitura Municipal de Tangará;PMT;Administração pública direta;Pública;Pública
Prefeitura Municipal de Tanhaçu;PMT;Administração pública direta;Pública;Pública
Prefeitura Municipal de Tapejara;PMT;Administração pública direta;Pública;Pública
Prefeitura Municipal de Tapiramutá;PMT;Administração pública direta;Pública;Pública
Prefeitura Municipal de Tapiratiba;PMT;Administração pública direta;Pública;Pública
Prefeitura Municipal de Tapurah;PMT;Administração pública direta;Pública;Pública
Prefeitura Municipal de Taquaral;PMT;Administração pública direta;Pública;Pública
Prefeitura Municipal de Taquarana;PMT;Administração pública direta;Pública;Pública
Prefeitura Municipal de Tarumirim;PMT;Administração pública direta;Pública;Pública
Prefeitura Municipal de Tavares;PMT;Administração pública direta;Pública;Pública
Prefeitura Municipal de Tenório;PMT;Administração pública direta;Pública;Pública
Prefeitura Municipal de Teofilândia;PMT;Administração pública direta;Pública;Pública
Prefeitura Municipal de Teolândia;PMT;Administração pública direta;Pública;Pública
Prefeitura Municipal de Terra Alta;PMTA;Administração pública direta;Pública;Pública
Prefeitura Municipal de Terra Nova;PMTN;Administração pública direta;Pública;Pública
Prefeitura Municipal de Teutônia;PMT;Administração pública direta;Pública;Pública
Prefeitura Municipal de Tigrinhos;PMT;Administração pública direta;Pública;Pública
Prefeitura Municipal de Timbauba dos Batistas;PMTB;Administração pública direta;Pública;Pública
Prefeitura Municipal de Tio Hugo;PMTH;Administração pública direta;Pública;Pública
Prefeitura Municipal de Tiros;PMT;Administração pública direta;Pública;Pública
Prefeitura Municipal de Tobias Barreto;PMTB;Administração pública direta;Pública;Pública
Prefeitura Municipal de Tocantins;PMT;Administração pública direta;Pública;Pública
Prefeitura Municipal de Tomé-Açu;DAE;Administração pública direta;Pública;Pública
Prefeitura Municipal de Toropi;PMT;Administração pública direta;Pública;Pública
Prefeitura Municipal de Três Arroios;PMTA;Administração pública direta;Pública;Pública
Prefeitura Municipal de Três Forquilhas;PMRF;Administração pública direta;Pública;Pública
Prefeitura Municipal de Triunfo;PMT;Administração pública direta;Pública;Pública
Prefeitura Municipal de Trizidela do Vale;PMTV;Administração pública direta;Pública;Pública
Prefeitura Municipal de Tuiuti;PMT;Administração pública direta;Pública;Pública
Prefeitura Municipal de Tumiritinga;PMT;Administração pública direta;Pública;Pública
Prefeitura Municipal de Tunápolis;PMT;Administração pública direta;Pública;Pública
Prefeitura Municipal de Tupanci do Sul;PMTS;Administração pública direta;Pública;Pública
Prefeitura Municipal de Tupandi;PMT;Administração pública direta;Pública;Pública
Prefeitura Municipal de Tupãssi;PMT;Administração pública direta;Pública;Pública
Prefeitura Municipal de Tupi Paulista;PMTP;Administração pública direta;Pública;Pública
Prefeitura Municipal de Turuçu;PMT;Administração pública direta;Pública;Pública
Prefeitura Municipal de Turvolândia;PMT;Administração pública direta;Pública;Pública
Prefeitura Municipal de Ubarana;PMU;Administração pública direta;Pública;Pública
Prefeitura Municipal de Ulianópolis;PMU;Administração pública direta;Pública;Pública
Prefeitura Municipal de Urandi;PMU;Administração pública direta;Pública;Pública
Prefeitura Municipal de Urucânia;PMU;Administração pública direta;Pública;Pública
Prefeitura Municipal de Urucuia;PMU;Administração pública direta;Pública;Pública
Prefeitura Municipal de Urupês;PMU;Administração pública direta;Pública;Pública
Prefeitura Municipal de Vacaria;PMV;Administração pública direta;Pública;Pública
Prefeitura Municipal de Vale de São Domingos;PMVSD;Administração pública direta;Pública;Pública
Prefeitura Municipal de Vale do Sol;PMVS;Administração pública direta;Pública;Pública
Prefeitura Municipal de Vale Real;PMVR;Administração pública direta;Pública;Pública
Prefeitura Municipal de Vanini;PMV;Administração pública direta;Pública;Pública
Prefeitura Municipal de Vargem;PMV;Administração pública direta;Pública;Pública
Prefeitura Municipal de Vargem Bonita;PMVB;Administração pública direta;Pública;Pública
Prefeitura Municipal de Varre-Sai;PMVS;Administração pública direta;Pública;Pública
Prefeitura Municipal de Várzea;PMV;Administração pública direta;Pública;Pública
Prefeitura Municipal de Várzea Alegre;PMVA;Administração pública direta;Pública;Pública
Prefeitura Municipal de Vassouras;PMV;Administração pública direta;Pública;Pública
Prefeitura Municipal de Venturosa;PMV;Administração pública direta;Pública;Pública
Prefeitura Municipal de Vera Cruz;PMVCZ;Administração pública direta;Pública;Pública
Prefeitura Municipal de Vera Mendes;PMVM;Administração pública direta;Pública;Pública
Prefeitura Municipal de Veranópolis;PMV;Administração pública direta;Pública;Pública
